{
  "defs": {
    "泛化": {
      "color": "#5eead4",
      "desc": "能否把學到的東西用在沒見過的情境",
      "kw": [
        "泛化",
        "generaliz",
        "新情境",
        "沒見過",
        "舉一反三",
        "樣本效率",
        "少量資料",
        "學得會"
      ]
    },
    "一致性": {
      "color": "#a3e635",
      "desc": "能力是否穩定，而非忽強忽弱（參差智能）",
      "kw": [
        "一致",
        "參差",
        "jagged",
        "低級錯",
        "穩定",
        "忽強忽弱",
        "高中數學"
      ]
    },
    "評測效度": {
      "color": "#fde047",
      "desc": "考試／benchmark 分數能否代表真實能力",
      "kw": [
        "評測",
        "benchmark",
        "分數",
        "考試",
        "測驗",
        "基準",
        "奧數",
        "律師考試"
      ]
    },
    "AGI定義": {
      "color": "#fdba74",
      "desc": "什麼才算通用人工智慧、用什麼當里程碑",
      "kw": [
        "AGI",
        "通用",
        "人類水準",
        "超級智慧",
        "里程碑"
      ]
    },
    "世界模型": {
      "color": "#67e8f9",
      "desc": "對物理世界的內在模型、具身與感官經驗",
      "kw": [
        "世界模型",
        "物理",
        "身體",
        "感官",
        "具身",
        "機器人",
        "貓",
        "影片"
      ]
    },
    "理解vs模仿": {
      "color": "#f0abfc",
      "desc": "是真的理解，還是逼真的模仿",
      "kw": [
        "理解",
        "模仿",
        "鸚鵡",
        "真的懂",
        "語意",
        "看起來",
        "逼真"
      ]
    },
    "持續學習": {
      "color": "#86efac",
      "desc": "部署後能否持續學新東西、累積記憶",
      "kw": [
        "持續學習",
        "記憶",
        "部署中",
        "遺忘",
        "邊做邊學",
        "自行學習"
      ]
    },
    "意識判準": {
      "color": "#c4b5fd",
      "desc": "用什麼標準判斷系統是否真有意識／感知",
      "kw": [
        "意識",
        "感受",
        "主觀",
        "感知",
        "知覺",
        "sentien",
        "conscious"
      ]
    },
    "意識表象": {
      "color": "#f9a8d4",
      "desc": "「看起來有意識」造成的錯覺與依附",
      "kw": [
        "看起來有意識",
        "表象",
        "錯覺",
        "擬人",
        "人格",
        "情感依附",
        "依附",
        "陪伴"
      ]
    },
    "自我陳述": {
      "color": "#fca5a5",
      "desc": "AI 說自己有感受／狀態時，能不能信",
      "kw": [
        "自我陳述",
        "宣稱",
        "自稱",
        "自我報告",
        "說自己",
        "自述"
      ]
    },
    "責任歸屬": {
      "color": "#fb7185",
      "desc": "出錯或造成傷害時，責任落在誰身上",
      "kw": [
        "責任",
        "誰負責",
        "承擔",
        "問責",
        "把關",
        "誰來"
      ]
    },
    "可解釋性": {
      "color": "#93c5fd",
      "desc": "能否看懂模型內部機制與決策理由",
      "kw": [
        "可解釋",
        "黑箱",
        "透明",
        "解釋",
        "內部機制",
        "機制",
        "不懂"
      ]
    },
    "對齊": {
      "color": "#fb923c",
      "desc": "AI 的目標與行為是否與人類意圖一致",
      "kw": [
        "對齊",
        "align",
        "欺騙",
        "目標",
        "行為改變",
        "安全"
      ]
    },
    "權力與控制": {
      "color": "#f472b6",
      "desc": "AI 取得或集中權力、人類能否保持控制",
      "kw": [
        "權力",
        "控制",
        "失控",
        "子目標",
        "集中",
        "失衡",
        "複製"
      ]
    },
    "治理監管": {
      "color": "#cbd5e1",
      "desc": "法規、產業規範與揭露義務",
      "kw": [
        "監管",
        "法規",
        "政府",
        "規範",
        "揭露",
        "政策",
        "禁止",
        "防護"
      ]
    },
    "語言": {
      "color": "#bef264",
      "desc": "語言本身：它和思考、理解的關係",
      "kw": []
    },
    "思考": {
      "color": "#7dd3fc",
      "desc": "思考的形式：需不需要語言、能不能被看見",
      "kw": []
    },
    "邊界": {
      "color": "#fcd34d",
      "desc": "「邊界」作為隱喻：語言、思考或能力的界線",
      "kw": []
    }
  },
  "patterns": {
    "落差診斷→新典範": {
      "color": "#e0f2fe",
      "desc": "觀察到能力落差 → 診斷缺少的要素 → 提出新的研究方向"
    },
    "風險鏈→治理對策": {
      "color": "#fef3c7",
      "desc": "指出特性 → 推到社會／安全風險 → 提出防護或治理做法"
    },
    "對立觀點→判準未決": {
      "color": "#ede9fe",
      "desc": "兩種觀點對照 → 判準本身仍有爭議"
    }
  },
  "tags": {
    "q1": [
      "一致性",
      "泛化",
      "評測效度"
    ],
    "q1:e0": [
      "一致性",
      "AGI定義"
    ],
    "q1:e1": [
      "AGI定義"
    ],
    "q1:e2": [
      "評測效度"
    ],
    "q1:e3": [
      "責任歸屬"
    ],
    "q2": [
      "世界模型",
      "泛化"
    ],
    "q2:e0": [
      "世界模型",
      "一致性"
    ],
    "q2:e1": [
      "世界模型",
      "理解vs模仿"
    ],
    "q2:e2": [
      "責任歸屬"
    ],
    "q3": [
      "泛化",
      "持續學習",
      "評測效度"
    ],
    "q3:e0": [
      "持續學習",
      "AGI定義"
    ],
    "q3:e1": [
      "持續學習",
      "責任歸屬",
      "對齊"
    ],
    "q3:e2": [
      "泛化",
      "對齊"
    ],
    "q4": [
      "理解vs模仿",
      "可解釋性"
    ],
    "q4:e0": [
      "意識判準"
    ],
    "q4:e1": [
      "權力與控制"
    ],
    "q4:e2": [
      "權力與控制",
      "對齊"
    ],
    "q5": [
      "意識表象",
      "理解vs模仿",
      "治理監管"
    ],
    "q5:e0": [
      "意識表象",
      "自我陳述",
      "治理監管"
    ],
    "q5:e1": [
      "意識判準"
    ],
    "q5:e2": [
      "意識表象"
    ],
    "q6": [
      "可解釋性",
      "對齊",
      "權力與控制",
      "責任歸屬"
    ],
    "q6:e0": [
      "可解釋性",
      "治理監管"
    ],
    "q6:e1": [
      "自我陳述",
      "意識判準",
      "可解釋性"
    ],
    "q6:e2": [
      "治理監管"
    ]
  },
  "process": {
    "q1": "落差診斷→新典範",
    "q2": "落差診斷→新典範",
    "q3": "落差診斷→新典範",
    "q4": "對立觀點→判準未決",
    "q5": "風險鏈→治理對策",
    "q6": "風險鏈→治理對策"
  }
}
